property_id,status_id,style_id,type_id,property_mls_number,property_apn_number,property_tax_number,property_address,property_address2,property_city,property_county,property_state,property_state_abbrev,property_zip,property_country,property_township,property_long_desc,property_med_desc,property_short_desc,property_value,property_listing_date,property_exp_date,property_date_created,property_date_updated,property_total_campaign_cost
50200,2,0,0,08909738,NULL,NULL,"690 Chandler Road",NULL,Gurnee,,IL,IL,60031,"United States",NULL,"Lovely 4th floor condo in move-in condition with  sweeping views of the golf course and pond. Light carpets neutral  throughout including living room and bedroom carpeting. Newly remodeled bath with walk-in shower & grab bar. New windows.  All the Heather Ridge amenities  including swimming  pools and clubhouses. The secure building  provides comfortable and gracious living. No rental units. Move in fees apply","Lovely 4th floor condo in move-in condition with  sweeping views of the golf course and pond. Light carpets neutral  throughout including living room and bedroom carpeting. Newly remodeled bath with walk-in shower & grab bar. New windows.  All the Heather Ridge amenities  including swimming  pools and clubhouses. The secure building  provides comfortable and gracious living. No rental units. Move in fees apply",NULL,89900,2015-05-02,2015-07-15,"2019-01-15 21:29:13","0000-00-00 00:00:00",0
50201,2,0,0,09929927,NULL,NULL,"3842 N Oconto Ave",NULL,Chicago,,IL,IL,60634,"United States",NULL,,,NULL,519000,2018-04-25,2018-07-25,"2019-01-15 21:29:13","0000-00-00 00:00:00",0
50202,2,0,0,09147254,NULL,NULL,"745 Savanna Springs Dr",NULL,"Lake Villa",,IL,IL,60046,"United States",NULL,"Located in sought-after Savanna Springs, enjoy this 3 bedroom, 3.5 bathroom home! Enter through the 2-story foyer/living room and be impressed with the hardwood floors throughout the first floor! Eat-in kitchen is open to the family room - great for entertaining!  Master bedroom with private full bathroom and dual closets.  Generous sized bedrooms. All new carpet on second floor (Feb, 2016) English basement offers plenty of sun light and is partially finished with new carpet (Feb, 2016) and a full bathroom with jetted tub near completion! Fantastic backyard with deck and large shed. Great interior lot across the street from park!  Grayslake High School!!","Located in sought-after Savanna Springs, enjoy this 3 bedroom, 3.5 bathroom home! Enter through the 2-story foyer/living room and be impressed with the hardwood floors throughout the first floor! Eat-in kitchen is open to the family room - great for entertaining!  Master bedroom with private full bathroom and dual closets.  Generous sized bedrooms. All new carpet on second floor (Feb, 2016) English basement offers plenty of sun light and is partially finished with new carpet (Feb, 2016) and a full bathroom with jetted tub near completion! Fantastic backyard with deck and large shed. Great interior lot across the street from park!  Grayslake High School!!",NULL,190000,2016-02-24,2016-04-27,"2019-01-15 21:29:13","0000-00-00 00:00:00",0
50203,2,0,0,09788802,NULL,NULL,"358 Rye Road",NULL,Mundelein,,IL,IL,60060,"United States",NULL,"Live on one of the largest lots in Loch Lomond. Almost an acre of private living. Updated throughout. 4 bedroom, 1 1/2 bathroom ranch house with full finished basement and detached garage. Newly finished hardwood floors on the first floor. Granite counters in kitchen and bathroom. Brand new stainless steel appliances and washer and dryer. New carpet in basement. 2 car detached garage.  Back deck and brick paver patio. Roof, gutters and siding 2011, Furnace and Air Conditioner 2017. Taxes do NOT reflect homestead exemption. Use of community lake and beach. Hurry! This one has it all.","Live on one of the largest lots in Loch Lomond. Almost an acre of private living. Updated throughout. 4 bedroom, 1 1/2 bathroom ranch house with full finished basement and detached garage. Newly finished hardwood floors on the first floor. Granite counters in kitchen and bathroom. Brand new stainless steel appliances and washer and dryer. New carpet in basement. 2 car detached garage.  Back deck and brick paver patio. Roof, gutters and siding 2011, Furnace and Air Conditioner 2017. Taxes do NOT reflect homestead exemption. Use of community lake and beach. Hurry! This one has it all.",NULL,234900,2017-10-28,2017-12-22,"2019-01-15 21:29:13","0000-00-00 00:00:00",0
50204,2,0,0,09752534,NULL,NULL,"259 Shadow Creek Circle",NULL,"Vernon Hills",,IL,IL,60061,"United States",NULL,"3 Bedroom, 2 Bath 1st Floor Ranch Unit in Gregg's Landing! Extensive updates in this meticulously maintained home by original owner. Brand new plush, neutral carpet installed throughout. Kitchen upgrades within the last 3 years include granite counters from MasterCraft Marble and Granite, custom island, 4-door refrigerator, 5-burner convection oven, dishwasher, microwave, under mount sink and garbage disposal, Grohe faucet, LED under cabinet lighting. High end LG True Steam Washer/Dryer new in 2014. Carrier Furnace and A/C new in 2016. Sunburst Polywood Plantation Shutters through entire home (maintenance free and energy efficient). 9' ceilings throughout! Large 17x12 Master Bedroom provides walk-in closet and private master bath with double sinks and whirlpool tub. Custom built storage room in extra deep garage. Walking distance to Mellody Park and Lake Charles Park. This one's a beauty!","3 Bedroom, 2 Bath 1st Floor Ranch Unit in Gregg's Landing! Extensive updates in this meticulously maintained home by original owner. Brand new plush, neutral carpet installed throughout. Kitchen upgrades within the last 3 years include granite counters from MasterCraft Marble and Granite, custom island, 4-door refrigerator, 5-burner convection oven, dishwasher, microwave, under mount sink and garbage disposal, Grohe faucet, LED under cabinet lighting. High end LG True Steam Washer/Dryer new in 2014. Carrier Furnace and A/C new in 2016. Sunburst Polywood Plantation Shutters through entire home (maintenance free and energy efficient). 9' ceilings throughout! Large 17x12 Master Bedroom provides walk-in closet and private master bath with double sinks and whirlpool tub. Custom built storage room in extra deep garage. Walking distance to Mellody Park and Lake Charles Park. This one's a beauty!",NULL,289900,2017-09-15,2017-10-26,"2019-01-15 21:29:13","0000-00-00 00:00:00",0
50205,2,0,0,08989720,NULL,NULL,"275 W Arden Lane",NULL,"Round Lake",,IL,IL,60073,"United States",NULL,"SERENITY, STYLE AND SPACE- THE BEST THAT LAKEWOOD GROVE HAS TO OFFER. FREMONT SCHOOLS!! RELAX ON THE PAVER STONE PATIO SIPPING YOUR FAVORITE BEVERAGE OVERLOOKING A LARGE TRANQUIL POND. SUPERB COLONIAL HAS MANY FANTASTIC HIGHLITES STARTING WITH GREAT CURB APPEAL, 3 CAR GARAGE. PROFESSIONAL LANDSCAPING. WHEN YOU ENTER THE FRONT DOOR YOU ARE IMMEDIATELY STRUCK BY THE SOARING 2 STORY FOYER WITH REAL HARDWOOD FLOORING. OFF TO THE LEFT IS THE FORMAL LIVING ROOM WITH 9' CEILINGS AND GORGEOUS CROWN MOLDING FOLLOWED BY THE SEPARATE DINING ROOM ALSO WITH CROWN MOLDING. THE KITCHEN IS A COOK'S DREAM WITH ITS HUGE OPEN CONCEPT SPACE WITH ISLAND, STAINLESS APPLIANCES, HUGE EATING AREA AND PANTRY CLOSET. THERE IS A FIRST FLOOR DEN/ LIBRARY/ OFFICE W FRENCH DOORS. TWO GREAT SPACES- ONE FOR ADULTS, ONE FOR KIDS. UPSTAIRS THE MBR AND MSTRBTH WILL TAKE YOUR BREATH AWAY. GIGANTIC UNFINSHD BASEMENT W 10' CEILING. A 10+ IN EVERY WAY. TAXES ARE $ 7,480.84 PLUS $ 2,414.08 SSA= 9894.92. SELLERS MOTIVATED!!","SERENITY, STYLE AND SPACE- THE BEST THAT LAKEWOOD GROVE HAS TO OFFER. FREMONT SCHOOLS!! RELAX ON THE PAVER STONE PATIO SIPPING YOUR FAVORITE BEVERAGE OVERLOOKING A LARGE TRANQUIL POND. SUPERB COLONIAL HAS MANY FANTASTIC HIGHLITES STARTING WITH GREAT CURB APPEAL, 3 CAR GARAGE. PROFESSIONAL LANDSCAPING. WHEN YOU ENTER THE FRONT DOOR YOU ARE IMMEDIATELY STRUCK BY THE SOARING 2 STORY FOYER WITH REAL HARDWOOD FLOORING. OFF TO THE LEFT IS THE FORMAL LIVING ROOM WITH 9' CEILINGS AND GORGEOUS CROWN MOLDING FOLLOWED BY THE SEPARATE DINING ROOM ALSO WITH CROWN MOLDING. THE KITCHEN IS A COOK'S DREAM WITH ITS HUGE OPEN CONCEPT SPACE WITH ISLAND, STAINLESS APPLIANCES, HUGE EATING AREA AND PANTRY CLOSET. THERE IS A FIRST FLOOR DEN/ LIBRARY/ OFFICE W FRENCH DOORS. TWO GREAT SPACES- ONE FOR ADULTS, ONE FOR KIDS. UPSTAIRS THE MBR AND MSTRBTH WILL TAKE YOUR BREATH AWAY. GIGANTIC UNFINSHD BASEMENT W 10' CEILING. A 10+ IN EVERY WAY. TAXES ARE $ 7,480.84 PLUS $ 2,414.08 SSA= 9894.92. SELLERS MOTIVATED!!",NULL,329900,2015-07-22,2015-10-30,"2019-01-15 21:29:14","0000-00-00 00:00:00",0
50206,2,0,0,08501742,NULL,NULL,"935 Ann Arbor Lane",NULL,"Vernon Hills",,IL,IL,60061,"United States",NULL,"Great Opportunity!  Fabulous second floor end unit offering you vaulted ceilings, open floor plan, attached garage and more! Living room open to dining room and kitchen. Eat-in kitchen w/sparkling appliances & window seat. Master includes walk-in closet and private bathroom. Additional bedroom, full bath and laundry complete the unit.","Great Opportunity!  Fabulous second floor end unit offering you vaulted ceilings, open floor plan, attached garage and more! Living room open to dining room and kitchen. Eat-in kitchen w/sparkling appliances & window seat. Master includes walk-in closet and private bathroom. Additional bedroom, full bath and laundry complete the unit.",NULL,137500,2013-12-11,2014-12-04,"2019-01-15 21:29:14","0000-00-00 00:00:00",0
50207,2,0,0,08708316,NULL,NULL,"6004 Greenwood Road",NULL,"Wonder Lake",,IL,IL,60097,"United States",NULL,"Seller says bring us any reasonable offer! Well maintained all brick ranch on fantastic wooded lot w/ towering oak trees. More room than you will know what to do with. 5 bedrooms, 4.5 baths, spacious layout w/ finished lower level offering rec room, 2nd familyroom, 5th bedroom. Some bedrooms w/ balconies overlooking 5 acres.  Upper & lower sun rooms, back yard decks, above ground pool, 3.5 car att garag","Seller says bring us any reasonable offer! Well maintained all brick ranch on fantastic wooded lot w/ towering oak trees. More room than you will know what to do with. 5 bedrooms, 4.5 baths, spacious layout w/ finished lower level offering rec room, 2nd familyroom, 5th bedroom. Some bedrooms w/ balconies overlooking 5 acres.  Upper & lower sun rooms, back yard decks, above ground pool, 3.5 car att garag",NULL,285000,2014-08-22,2015-07-02,"2019-01-15 21:29:14","0000-00-00 00:00:00",0
50208,2,0,0,09928807,NULL,NULL,"2805 Glacier Way",NULL,Wauconda,,IL,IL,60084,"United States",NULL,"Desirable Liberty Lakes 2 story townhouse located in a community surrounded by forest preserve with easy access to the Millennium Trail.  This beautiful unit has an open floor plan with 9' ceilings on the first floor.  The 2 story living room features a gas fireplace with media niche & plant shelf and 2 stories of windows overflowing with natural light.  Elegant kitchen boasts 42" dark maple cabinets, black appliances,  ceramic tile flooring, a breakfast bar and freshly painted. Wood flooring in the living room and dining area. 2nd floor features a luxury master suite with his & her closets. Gorgeous master bath features Pottery Barn double bowled white vanity with Carrera marble countertop and Carrera marble tub surround with glass doors, and designer flooring.  2nd bedroom and hall bath are generously sized and upgraded.  Anderson storm door with built in screen, heated 2 car garage, a concrete patio with spacious green area.  You will be proud to call this home.","Desirable Liberty Lakes 2 story townhouse located in a community surrounded by forest preserve with easy access to the Millennium Trail.  This beautiful unit has an open floor plan with 9' ceilings on the first floor.  The 2 story living room features a gas fireplace with media niche & plant shelf and 2 stories of windows overflowing with natural light.  Elegant kitchen boasts 42" dark maple cabinets, black appliances,  ceramic tile flooring, a breakfast bar and freshly painted. Wood flooring in the living room and dining area. 2nd floor features a luxury master suite with his & her closets. Gorgeous master bath features Pottery Barn double bowled white vanity with Carrera marble countertop and Carrera marble tub surround with glass doors, and designer flooring.  2nd bedroom and hall bath are generously sized and upgraded.  Anderson storm door with built in screen, heated 2 car garage, a concrete patio with spacious green area.  You will be proud to call this home.",NULL,172500,2018-04-25,2018-07-27,"2019-01-15 21:29:14","0000-00-00 00:00:00",0
50209,2,0,0,09974361,NULL,NULL,"1208 Gulfstream Pkwy",NULL,Libertyville,,IL,IL,60048,"United States",NULL,"Cul de sac location for this sun-drenched end unit ranch townhouse. 1800 square feet of spacious living. The master bedroom includes a walk-in closet, a large standard closet, and an oversized bathroom with dual vanity.  The family room is large enough to be used as a den or made into a 3rd bedroom. The large kitchen has newer stainless appliances with an eat-in area. Separate laundry room with a new washer & dryer. Great vaulted ceilings plus skylights. 2 outdoor patio areas. New carpet and fresh paint throughout. New AC unit and new furnace! 2 car attached garage with new garage door!","Cul de sac location for this sun-drenched end unit ranch townhouse. 1800 square feet of spacious living. The master bedroom includes a walk-in closet, a large standard closet, and an oversized bathroom with dual vanity.  The family room is large enough to be used as a den or made into a 3rd bedroom. The large kitchen has newer stainless appliances with an eat-in area. Separate laundry room with a new washer & dryer. Great vaulted ceilings plus skylights. 2 outdoor patio areas. New carpet and fresh paint throughout. New AC unit and new furnace! 2 car attached garage with new garage door!",NULL,295000,2018-06-27,2018-08-20,"2019-01-15 21:29:14","0000-00-00 00:00:00",0
50210,2,0,0,10004493,NULL,NULL,"1601 Holian Dr",NULL,"Spring Grove",,IL,IL,60081,"United States",NULL,"Stunning custom all-brick 2-story w/ full walkout basement ensconced on private 1-acre hill, landscaped for parklike beauty. Panoramic views from windows, deck & terrace overlooking yard. Sunset views from master suite! Huge eat-in kitchen renovated 2016 w/ granite counters, real stone backsplash, has oak cabinets, view of fireplace, sliders to spacious 2-tiered no-maintenance deck w/ vintage steel basket balusters. 1st-floor office/den/BR easily converted to future MBR or guest suite. Newly carpeted family room 2018 w/ skylights. Upstairs: full master suite w/ jet tub, separate shower, 2 vanities, walk-in closet, ceiling fan & balcony; 3 more bedrooms, laundry room, finished attic/"secret" bonus room. Elegantly appointed finishes inside & out + pragmatic extras like added insulation throughout for warmth & soundproofing, roughed-in plumbing in unfinished basement for future bath, 3 heat & air zones, 3-car garage + large shed for even more space! New AC 2018. Grab it now! It's a 10!","Stunning custom all-brick 2-story w/ full walkout basement ensconced on private 1-acre hill, landscaped for parklike beauty. Panoramic views from windows, deck & terrace overlooking yard. Sunset views from master suite! Huge eat-in kitchen renovated 2016 w/ granite counters, real stone backsplash, has oak cabinets, view of fireplace, sliders to spacious 2-tiered no-maintenance deck w/ vintage steel basket balusters. 1st-floor office/den/BR easily converted to future MBR or guest suite. Newly carpeted family room 2018 w/ skylights. Upstairs: full master suite w/ jet tub, separate shower, 2 vanities, walk-in closet, ceiling fan & balcony; 3 more bedrooms, laundry room, finished attic/"secret" bonus room. Elegantly appointed finishes inside & out + pragmatic extras like added insulation throughout for warmth & soundproofing, roughed-in plumbing in unfinished basement for future bath, 3 heat & air zones, 3-car garage + large shed for even more space! New AC 2018. Grab it now! It's a 10!",NULL,300000,2018-07-06,2018-10-10,"2019-01-15 21:29:14","0000-00-00 00:00:00",0
50211,2,0,0,09108196,NULL,NULL,"317 Robincrest Ln",NULL,Lindenhurst,,IL,IL,60046,"United States",NULL,"MOVE IN READY!! This home has been well maintained by its current and prior owner's. Approximately 2200 square feet in this 4 bedroom 2 bath home with bonus office/den (possible 5th bedroom). Great floor plan for entertaining any size group. Efficient kitchen with lots of cabinets and quartz counter tops.  Enjoy the large yard and oversize deck with pond views for summertime gatherings. Walk Out Lower level includes Family Room with gas fireplace.  Laundry/utility room with built-ins.  Quick close possible!","MOVE IN READY!! This home has been well maintained by its current and prior owner's. Approximately 2200 square feet in this 4 bedroom 2 bath home with bonus office/den (possible 5th bedroom). Great floor plan for entertaining any size group. Efficient kitchen with lots of cabinets and quartz counter tops.  Enjoy the large yard and oversize deck with pond views for summertime gatherings. Walk Out Lower level includes Family Room with gas fireplace.  Laundry/utility room with built-ins.  Quick close possible!",NULL,205900,2016-01-02,2016-02-09,"2019-01-15 21:29:14","0000-00-00 00:00:00",0
50212,2,0,0,09666204,NULL,NULL,"2127 N Haig Court",NULL,Palatine,,IL,IL,60074,"United States",NULL,"Perfectly poised split in the center of a peaceful cul-de-sac! Great landscape greets you as approach the front door. Inside you'll love the bright living room with large picture window and rich hardwood floors! Dining room is right off the kitchen for easy serving! Spacious kitchen features solid wood cabinetry, loads of counter prep space & sliding glass door to covered patio & backyard! Nice sized bedrooms upstairs all with hardwood floors and ceiling fans to keep you cool. Full hall bath with timeless vanity & white counter. Lower level includes a recreation space, laundry area and another full bathroom! Cement crawl space is great for storage! This oversized yard is a delight! Fully fenced, mature landscape, huge storage shed - plenty of space for summer time fun! Covered patio is a bonus to provide shade on those warm days! Great location that's close to all your shopping and dining needs! Move right in to enjoy this darling home!","Perfectly poised split in the center of a peaceful cul-de-sac! Great landscape greets you as approach the front door. Inside you'll love the bright living room with large picture window and rich hardwood floors! Dining room is right off the kitchen for easy serving! Spacious kitchen features solid wood cabinetry, loads of counter prep space & sliding glass door to covered patio & backyard! Nice sized bedrooms upstairs all with hardwood floors and ceiling fans to keep you cool. Full hall bath with timeless vanity & white counter. Lower level includes a recreation space, laundry area and another full bathroom! Cement crawl space is great for storage! This oversized yard is a delight! Fully fenced, mature landscape, huge storage shed - plenty of space for summer time fun! Covered patio is a bonus to provide shade on those warm days! Great location that's close to all your shopping and dining needs! Move right in to enjoy this darling home!",NULL,255000,2017-06-21,2017-08-30,"2019-01-15 21:29:14","0000-00-00 00:00:00",0
50213,2,0,0,09637109,NULL,NULL,"2 Oak Creek Drive",NULL,"Buffalo Grove",,IL,IL,60089,"United States",NULL,"GREAT 1BED/1BATH END UNIT IN THE ARBORS! FUNCTIONAL LAYOUT W/LARGE BEDROOM, TONS OF CLOSETS/ LARGE/LR & SEPARATE DINING & PRIVATE BALCONY.  FRESHLY PAINTED AND NEW CARPET.  COMPLEX AMENITIES INCLUDE OUTDOOR POOL/SKATE PARK/TENNIS & BBALL COURTS/WALKING PATHS & GRILL AREA.   CONVENIENTLY LOCATED NEAR SCHOOLS, SHOPPING, DINING, ENTERTAINMENT, AND EASY ACCESS TO RT  53 FOR COMMUTERS! DOWN THE STREET FROM BG HIGH! THIS IS A MUST SEE! ESTATE SALE 'AS-IS'","GREAT 1BED/1BATH END UNIT IN THE ARBORS! FUNCTIONAL LAYOUT W/LARGE BEDROOM, TONS OF CLOSETS/ LARGE/LR & SEPARATE DINING & PRIVATE BALCONY.  FRESHLY PAINTED AND NEW CARPET.  COMPLEX AMENITIES INCLUDE OUTDOOR POOL/SKATE PARK/TENNIS & BBALL COURTS/WALKING PATHS & GRILL AREA.   CONVENIENTLY LOCATED NEAR SCHOOLS, SHOPPING, DINING, ENTERTAINMENT, AND EASY ACCESS TO RT  53 FOR COMMUTERS! DOWN THE STREET FROM BG HIGH! THIS IS A MUST SEE! ESTATE SALE 'AS-IS'",NULL,75000,2017-05-24,2017-08-01,"2019-01-15 21:29:14","0000-00-00 00:00:00",0
50214,2,0,0,09197112,NULL,NULL,"112 Hitching Post Lane",NULL,Grayslake,,IL,IL,60030,"United States",NULL,"Beautiful and spotless Prairie II with Hardwood floors in entry, kitchen, and breakfast room.  Great kitchen with lots 42" cabinets and counter space with under cabinet lighting.  Nice sized breakfast room. Formal Dining room opens to good sized living room with lots of room for entertaining or relaxation.  Custom window treatments.  Large Master bedroom with walk in closet and full bath with tub opens to its own sitting room.  Large 2nd bedroom and full hall bath.  Good sized screened porch off of Living Room.  24x20 garage","Beautiful and spotless Prairie II with Hardwood floors in entry, kitchen, and breakfast room.  Great kitchen with lots 42" cabinets and counter space with under cabinet lighting.  Nice sized breakfast room. Formal Dining room opens to good sized living room with lots of room for entertaining or relaxation.  Custom window treatments.  Large Master bedroom with walk in closet and full bath with tub opens to its own sitting room.  Large 2nd bedroom and full hall bath.  Good sized screened porch off of Living Room.  24x20 garage",NULL,154900,2016-04-15,2016-06-24,"2019-01-15 21:29:15","0000-00-00 00:00:00",0
50215,2,0,0,09361073,NULL,NULL,"5456 N Nashville Avenue",NULL,Chicago,,IL,IL,60656,"United States",NULL,"Lovely Home in Norwood Park with Large Rooms and 8.5ft Tall Ceilings Needs Updating. Hardwood Floors Under Carpeting in Living Room, Dining Room, and Bedrooms on Main Floor. Enjoy Your Wood Burning Fireplace on Cold Evenings and Hang Your Christmas Stockings From the Mantle.The Eat-In Kitchen is 17x14. The Master Bedroom has a 6' deep closet. Newer Windows Throughout, Tuckpointing 2007, Hot Water Tank 2011. The  Lower Level has been Fixed Up as an In-Law Apartment with its Own Kitchen, 2 Bedrooms, Living Room and Full Bath.  Beautiful Yard with Lots of Plants. 2 1/2 Car Oversized Brick Garage. Bring Your Decorating Ideas. Well Maintained Home With Good Bones  Being Sold As Is.","Lovely Home in Norwood Park with Large Rooms and 8.5ft Tall Ceilings Needs Updating. Hardwood Floors Under Carpeting in Living Room, Dining Room, and Bedrooms on Main Floor. Enjoy Your Wood Burning Fireplace on Cold Evenings and Hang Your Christmas Stockings From the Mantle.The Eat-In Kitchen is 17x14. The Master Bedroom has a 6' deep closet. Newer Windows Throughout, Tuckpointing 2007, Hot Water Tank 2011. The  Lower Level has been Fixed Up as an In-Law Apartment with its Own Kitchen, 2 Bedrooms, Living Room and Full Bath.  Beautiful Yard with Lots of Plants. 2 1/2 Car Oversized Brick Garage. Bring Your Decorating Ideas. Well Maintained Home With Good Bones  Being Sold As Is.",NULL,250000,2016-10-06,2016-12-20,"2019-01-15 21:29:15","0000-00-00 00:00:00",0
50216,2,0,0,09016211,NULL,NULL,"2044 Stapleton Road",NULL,"New Lenox",,IL,IL,60451,"United States",NULL,"A MUST SEE:  New, energy star(R) home, move in ready and packed with amenities.  This 3226 sq. ft. open floor plan hosts a supersized cafe kitchen with quartz countertops, double oven, stove cooktop, stainless appliances, maple cabinets and two oversized islands.  Hardwood floors accompany a large open living space on the main level.  This home also features an upstairs loft along with four spacious bedrooms.  The master suite includes a coffered ceiling with a luxury serenity shower.  Built by America's #1 builder, DR Horton Homes, this home includes a variety of detail.  Nestled in one of New Lenox' newest communities, Bristol Park.  Don't forget to check out the walking trail that surrounds two ponds stocked perfect for fishing or enjoying the outdoors.  Ask about builder's lender incentives.","A MUST SEE:  New, energy star(R) home, move in ready and packed with amenities.  This 3226 sq. ft. open floor plan hosts a supersized cafe kitchen with quartz countertops, double oven, stove cooktop, stainless appliances, maple cabinets and two oversized islands.  Hardwood floors accompany a large open living space on the main level.  This home also features an upstairs loft along with four spacious bedrooms.  The master suite includes a coffered ceiling with a luxury serenity shower.  Built by America's #1 builder, DR Horton Homes, this home includes a variety of detail.  Nestled in one of New Lenox' newest communities, Bristol Park.  Don't forget to check out the walking trail that surrounds two ponds stocked perfect for fishing or enjoying the outdoors.  Ask about builder's lender incentives.",NULL,399899,2015-08-19,2015-09-29,"2019-01-15 21:29:15","0000-00-00 00:00:00",0
