property_id,status_id,style_id,type_id,property_mls_number,property_apn_number,property_tax_number,property_address,property_address2,property_city,property_county,property_state,property_state_abbrev,property_zip,property_country,property_township,property_long_desc,property_med_desc,property_short_desc,property_value,property_listing_date,property_exp_date,property_date_created,property_date_updated,property_total_campaign_cost
50071,2,0,0,5546706,NULL,NULL,"15634 N 29th Way",NULL,Phoenix,,AZ,AZ,85032,"United States",NULL,"Simply an adorable town home you are sure to love. 2 spacious bedrooms and 2 1/2 baths.  The kitchen has all the counter and cabinet space you would ever need.  The home has an open flow and feel to it and the back is quite cozy and has a a covered patio.  Priced like this it is sure not to last too long so you better hurry.  Thanks for stopping in and for bringing your buyers.","Simply an adorable town home you are sure to love. 2 spacious bedrooms and 2 1/2 baths.  The kitchen has all the counter and cabinet space you would ever need.  The home has an open flow and feel to it and the back is quite cozy and has a a covered patio.  Priced like this it is sure not to last too long so you better hurry.  Thanks for stopping in and for bringing your buyers.",NULL,150000,2017-01-13,2017-02-24,"2019-01-15 17:39:04","0000-00-00 00:00:00",0
50072,2,0,0,5833731,NULL,NULL,"6323 W Williams St",NULL,Phoenix,,AZ,AZ,85043,"United States",NULL,"Cozy 3 bedroom, 2 bathroom, great room floor plan. Great price for a newer home, perfect for a growing family! Granite slab counter, 20'' tile. New water heater.  Wooden Playhouse convey. Please see photos.","Cozy 3 bedroom, 2 bathroom, great room floor plan. Great price for a newer home, perfect for a growing family! Granite slab counter, 20'' tile. New water heater.  Wooden Playhouse convey. Please see photos.",NULL,190000,2018-10-15,2018-12-05,"2019-01-15 18:03:04","0000-00-00 00:00:00",0
50073,2,0,0,5856606,NULL,NULL,"1500 W Rio Salado Pkwy",NULL,Mesa,,AZ,AZ,85201,"United States",NULL,"Can you say perfect location? Come take a look at this beautiful townhome, located in the very popular Country Club Heights. Home is just minutes away from the Cubs Spring Training Stadium, Shopping, and Restaurants. This home has been well taken care of, and has some pretty great updates. Light and bright neutral paint, white cabinets, and granite tile counter tops. You won't want to miss this amazing deal.","Can you say perfect location? Come take a look at this beautiful townhome, located in the very popular Country Club Heights. Home is just minutes away from the Cubs Spring Training Stadium, Shopping, and Restaurants. This home has been well taken care of, and has some pretty great updates. Light and bright neutral paint, white cabinets, and granite tile counter tops. You won't want to miss this amazing deal.",NULL,160000,2018-12-11,2019-01-11,"2019-01-15 18:03:05","0000-00-00 00:00:00",0
50074,2,0,0,5829658,NULL,NULL,"20996 E Cherrywood Dr",NULL,"Queen Creek",,AZ,AZ,85142,"United States",NULL,"Beautifully upgraded home located in Desirable Hastings Farms Neighborhood. This Amazing home sits on a large corner lot with an RV GATE and no neighbors behind. Upgraded flooring throughout the house, extending into the Great Room. Great room includes rear surround speakers. This home features 3 bedrooms and 2 full bath on an open floor plan. Kitchen includes upgraded Granite counter tops, Maple Cabinets, and all Stainless Steel appliances.","Beautifully upgraded home located in Desirable Hastings Farms Neighborhood. This Amazing home sits on a large corner lot with an RV GATE and no neighbors behind. Upgraded flooring throughout the house, extending into the Great Room. Great room includes rear surround speakers. This home features 3 bedrooms and 2 full bath on an open floor plan. Kitchen includes upgraded Granite counter tops, Maple Cabinets, and all Stainless Steel appliances.",NULL,249000,2018-10-05,2018-12-12,"2019-01-15 18:03:07","0000-00-00 00:00:00",0
50075,2,0,0,5847277,NULL,NULL,"19777 N 76th St",NULL,Scottsdale,,AZ,AZ,85255,"United States",NULL,"This  ground unit condo has it all!  Completely remodeled w/new cabinets/ granite counters /exquisite backsplash, SS appliances, newly updated baths, neutral colors, beautiful wood floors & new carpet! Located in the Venu, a sought after gated community w/ resort style living: 24 hour security, concierge service, executive chef on staff (prepares evening meals/bring your wine & visit w/ all your neighbors)! Great location: ground level unit w/rare two car garage. The VENU offers an exceptional community center featuring sparkling pools, Jacuzzis, fantastic workout facilities w/free daily classes, complimentary popcorn in the luxurious movie theater, comp.  coffee/  tea/ lemonade, business center, video media room, reading area, pool tables, wine fridge! Resort style living at its best!","This  ground unit condo has it all!  Completely remodeled w/new cabinets/ granite counters /exquisite backsplash, SS appliances, newly updated baths, neutral colors, beautiful wood floors & new carpet! Located in the Venu, a sought after gated community w/ resort style living: 24 hour security, concierge service, executive chef on staff (prepares evening meals/bring your wine & visit w/ all your neighbors)! Great location: ground level unit w/rare two car garage. The VENU offers an exceptional community center featuring sparkling pools, Jacuzzis, fantastic workout facilities w/free daily classes, complimentary popcorn in the luxurious movie theater, comp.  coffee/  tea/ lemonade, business center, video media room, reading area, pool tables, wine fridge! Resort style living at its best!",NULL,285000,2018-11-15,2019-01-04,"2019-01-15 18:03:07","0000-00-00 00:00:00",0
50076,2,0,0,5838966,NULL,NULL,"8761 W Cordes Rd",NULL,Tolleson,,AZ,AZ,85353,"United States",NULL,"You will LOVE this stunning home! Step inside to find soaring ceilings, beautiful flooring, neutral paint, 5 bedrooms, and 3 full bathrooms! There is a single bedroom downstairs with a full bathroom and 4 additional bedrooms upstairs including the expansive master suite! The kitchen boasts granite counter tops, 42 inch upper cabinets with ample cabinet and counter space plus an island and brand new stainless steel appliances! The backyard is perfect for entertaining with synthetic grass, covered patio with pergola and a sparkling pool! Your new home comes complete with two brand new outdoor AC units and a beautiful park area to the West so you can enjoy even more room to play! Don't let this home pass you by, it will go quick!","You will LOVE this stunning home! Step inside to find soaring ceilings, beautiful flooring, neutral paint, 5 bedrooms, and 3 full bathrooms! There is a single bedroom downstairs with a full bathroom and 4 additional bedrooms upstairs including the expansive master suite! The kitchen boasts granite counter tops, 42 inch upper cabinets with ample cabinet and counter space plus an island and brand new stainless steel appliances! The backyard is perfect for entertaining with synthetic grass, covered patio with pergola and a sparkling pool! Your new home comes complete with two brand new outdoor AC units and a beautiful park area to the West so you can enjoy even more room to play! Don't let this home pass you by, it will go quick!",NULL,275000,2018-10-26,2018-12-27,"2019-01-15 18:03:09","0000-00-00 00:00:00",0
50077,2,0,0,5501864,NULL,NULL,"927 E La Jolla Drive",NULL,Tempe,,AZ,AZ,85282,"United States",NULL,"Awesome tri-level 4 bedroom 2.5 bath home in a great Tempe location. Spacious floor plan, many upgrades, newly resurfaced pebble tec pool - Move-in ready. A MUST SEE!","Awesome tri-level 4 bedroom 2.5 bath home in a great Tempe location. Spacious floor plan, many upgrades, newly resurfaced pebble tec pool - Move-in ready. A MUST SEE!",NULL,1900,2016-09-23,2016-10-13,"2019-01-15 18:13:55","0000-00-00 00:00:00",0
50078,2,0,0,5308483,NULL,NULL,"991 N Florence Drive",NULL,Chandler,,AZ,AZ,85226,"United States",NULL,"LOCATED IN A GREAT CHANDLER NEIGHBORHOOD. THIS HOUSE HAS A VERY POPULAR OPEN FLOOR PLAN, WITH A CUSTOM BUILT-IN ENTERTAINMENT CENTER, AN EXTREMELY OVERSIZED LOT GREAT FOR ENTERTAINING, A PEBBLETEC POOL, FRESH PAINT AND MUCH MORE. EXTREMELY EASY TO SHOW, GREAT COMMUNITY, PLEASE CALL BEFORE SHOWING TO PUT DOGS AWAY.","LOCATED IN A GREAT CHANDLER NEIGHBORHOOD. THIS HOUSE HAS A VERY POPULAR OPEN FLOOR PLAN, WITH A CUSTOM BUILT-IN ENTERTAINMENT CENTER, AN EXTREMELY OVERSIZED LOT GREAT FOR ENTERTAINING, A PEBBLETEC POOL, FRESH PAINT AND MUCH MORE. EXTREMELY EASY TO SHOW, GREAT COMMUNITY, PLEASE CALL BEFORE SHOWING TO PUT DOGS AWAY.",NULL,259500,2015-07-12,2015-10-20,"2019-01-15 18:13:55","0000-00-00 00:00:00",0
50079,2,0,0,5663841,NULL,NULL,"16654 S 36TH Way",NULL,Phoenix,,AZ,AZ,85048,"United States",NULL,"Elegant 2 story home in Lakewood. Beautiful, well maintained 4 Bedroom 2.5 Bath Single Family Home in the Lakewood Community. Pool, remodeled Kitchen with Granite Counters, new Cabinets, Dishwasher, Double Oven, Spacious Master Bath, Balcony off Master Bedroom. Ceramic Tile Downstairs. Near Dining, Shopping, Parks and Lake. Available to show beginning Sunday 9/24/17. PLEASE NOTE: HOME IS NOT FURNISHED. FURNITURE SEEN IN PICTURES WILL NOT BE IN THE HOME WHEN VIEWING/SHOWING.","Elegant 2 story home in Lakewood. Beautiful, well maintained 4 Bedroom 2.5 Bath Single Family Home in the Lakewood Community. Pool, remodeled Kitchen with Granite Counters, new Cabinets, Dishwasher, Double Oven, Spacious Master Bath, Balcony off Master Bedroom. Ceramic Tile Downstairs. Near Dining, Shopping, Parks and Lake. Available to show beginning Sunday 9/24/17. PLEASE NOTE: HOME IS NOT FURNISHED. FURNITURE SEEN IN PICTURES WILL NOT BE IN THE HOME WHEN VIEWING/SHOWING.",NULL,2195,2017-09-22,2017-10-04,"2019-01-15 18:13:55","0000-00-00 00:00:00",0
50080,2,0,0,5419470,NULL,NULL,"16654 S 36TH Way",NULL,Phoenix,,AZ,AZ,85048,"United States",NULL,"Enjoy resort style living in this elegant 2 story home. Beautiful, well maintained 4 bdrm 2.5 bath single family home in the wonderful Lakewood Community. Sparkling pool, luscious yard, Newly remodeled kitchen w/granite counters. New cabinets, new dishwasher, double oven.   spacious master bath. Balcony off master bdrm. Lovely ceramic tile downstairs. Near dining, shopping, parks and lake. Waiting for You!","Enjoy resort style living in this elegant 2 story home. Beautiful, well maintained 4 bdrm 2.5 bath single family home in the wonderful Lakewood Community. Sparkling pool, luscious yard, Newly remodeled kitchen w/granite counters. New cabinets, new dishwasher, double oven.   spacious master bath. Balcony off master bdrm. Lovely ceramic tile downstairs. Near dining, shopping, parks and lake. Waiting for You!",NULL,2195,2016-03-28,2016-06-15,"2019-01-15 18:13:56","0000-00-00 00:00:00",0
50081,2,0,0,5292277,NULL,NULL,"1106 S Surfside Drive",NULL,Gilbert,,AZ,AZ,85233,"United States",NULL,"Adorable home in desirable Islands Community in Gilbert. Features corner fireplace & skylights, open split FP; double sinks in M bath; SS Appliances, eat in kitchen or separate dining area; Enjoy biking, walking path, clubhouse, rec, childrens playground.","Adorable home in desirable Islands Community in Gilbert. Features corner fireplace & skylights, open split FP; double sinks in M bath; SS Appliances, eat in kitchen or separate dining area; Enjoy biking, walking path, clubhouse, rec, childrens playground.",NULL,189900,2015-06-10,2015-07-16,"2019-01-15 18:13:56","0000-00-00 00:00:00",0
50082,2,0,0,5217585,NULL,NULL,"10054 S 44TH Street",NULL,Phoenix,,AZ,AZ,85044,"United States",NULL,"Beautiful 3 bdrm/2bath home for lease. Short distance to freeway - newer travertine tile in living room; hardwood floors in bedrooms. Remodeled bathrooms with granite sink counters and newly tiled showers. Large backyard with mountain views. Great Ahwatukee neighborhood across from Western Star Park. A must see!","Beautiful 3 bdrm/2bath home for lease. Short distance to freeway - newer travertine tile in living room; hardwood floors in bedrooms. Remodeled bathrooms with granite sink counters and newly tiled showers. Large backyard with mountain views. Great Ahwatukee neighborhood across from Western Star Park. A must see!",NULL,1295,2015-01-04,2015-02-05,"2019-01-15 18:13:56","0000-00-00 00:00:00",0
50083,1,0,0,1396019,NULL,NULL,"10010 NE 138th Place",NULL,Kirkland,,WA,WA,98034,"United States",NULL,"Great starter home in Kirkland, Beautiful 2 Bed/1.5 Bath town home style with all new paint, laminate and carpet throughout. Upstairs features 2 bedrooms and a full bathroom as well as a laundry closet. Down stairs has an open floor plan with living room/dining room all open. Enjoy the large private fully fenced back yard, perfect for BBQ's or just relaxing. Easy commute from this great location.","Great starter home in Kirkland, Beautiful 2 Bed/1.5 Bath town home style with all new paint, laminate and carpet throughout. Upstairs features 2 bedrooms and a full bathroom as well as a laundry closet. Down stairs has an open floor plan with living room/dining room all open. Enjoy the large private fully fenced back yard, perfect for BBQ's or just relaxing. Easy commute from this great location.",NULL,339950,2018-12-28,2019-01-16,"2019-01-15 18:17:47","0000-00-00 00:00:00",0
50084,5,0,0,6308295,NULL,NULL,"1413 Arch St",NULL,"Colorado Springs",,CO,CO,80904,"United States",NULL,"INVESTOR SPECIAL!! Come own the chance to live or develop on the west side close to I-25 and Hwy 24, Colorado Avenue, downtown, shopping, restaurants, parks, and schools. Adjacent property in back with alley access for sale at MLS#6635959, 1413 1/2 Arch St. Seller prefers to sell both lots to one buyer. One water tap serves both properties. If sold separately, 2nd tap required for back lot. CSU permit estimate and SPD attached. Zoned R-2, option to purchase both lots and develop a duplex.","INVESTOR SPECIAL!! Come own the chance to live or develop on the west side close to I-25 and Hwy 24, Colorado Avenue, downtown, shopping, restaurants, parks, and schools. Adjacent property in back with alley access for sale at MLS#6635959, 1413 1/2 Arch St. Seller prefers to sell both lots to one buyer. One water tap serves both properties. If sold separately, 2nd tap required for back lot. CSU permit estimate and SPD attached. Zoned R-2, option to purchase both lots and develop a duplex.",NULL,130000,2018-12-28,2019-01-16,"2019-01-15 18:30:36","0000-00-00 00:00:00",0
50085,5,0,0,6635959,NULL,NULL,"Arch Street",NULL,"Colorado Springs",,CO,CO,80904,"United States",NULL,"INVESTOR SPECIAL!  Value in the land and development potential. Structure needs either extensive remodel (new roof, electrical) or torn down. Zoned R-2 (Two-Family Residential/Duplex). Adjacent lot in front at MLS #6308295 (1413 Arch St) also for sale. Seller prefers to sell both lots to same buyer.  One water tap serves both properties. If lots are sold separately, Utilities requires a water tap for this lot. See attached permit fees & Seller Property Disclosure. Sold As-Is.","INVESTOR SPECIAL!  Value in the land and development potential. Structure needs either extensive remodel (new roof, electrical) or torn down. Zoned R-2 (Two-Family Residential/Duplex). Adjacent lot in front at MLS #6308295 (1413 Arch St) also for sale. Seller prefers to sell both lots to same buyer.  One water tap serves both properties. If lots are sold separately, Utilities requires a water tap for this lot. See attached permit fees & Seller Property Disclosure. Sold As-Is.",NULL,75000,2018-12-28,2019-01-16,"2019-01-15 18:30:36","0000-00-00 00:00:00",0
50086,1,0,1,2186590,,,"1076 Spring Haven Ln",,Madisonville,,LA,LA,70447,"United States",,"Bring your Toys! &#xD;&#xA;4 car custom garage w/A/C! ($36K upgrade!) Imagine your classic car in the lap of luxury! $5500.00 garage floor coating. Immaculate tri-split home! Kitchen-aid appliances. Cedar beams. Whole house 20K generator. , Oversized patio with built in grill. Gorgeous master bath with granite tub surround. Coffered ceiling in Master. 40' wide driveway. Backyard access, great for crawfish boils! Floor to ceiling window coverings. Located in elegant subdivision. Best school district! $85K in extras!","Bring your Toys! &#xD;&#xA;4 car custom garage w/A/C! ($36K upgrade!) Imagine your classic car in the lap of luxury! $5500.00 garage floor coating. Immaculate tri-split home! Kitchen-aid appliances. Cedar beams. Whole house 20K generator. , Oversized patio with built in grill. Gorgeous master bath with granite tub surround. Coffered ceiling in Master. 40' wide driveway. Backyard access, great for crawfish boils! Floor to ceiling window coverings. Located in elegant subdivision. Best school district! $85K in extras!",,439900,2019-01-12,2019-01-18,"2019-01-15 18:51:23","2019-01-18 17:13:42",0
50087,2,0,0,2134107,NULL,NULL,"75652 Sylvia Dr",NULL,Covington,,LA,LA,70435,"United States",NULL,"NEW CONSTRUCTION 4bd/2bth WITH A BONUS ROOM AND AN UPSTAIRS GAME ROOM. Located in St. Tammany, with great schools. This home comes with wood flooring, granite, stainless gas appliances and more. The home has an open concept with tons of windows for natural light to pour in. This home features a 2 car garage, covered back patio, and huge closets with real wood shelving.","NEW CONSTRUCTION 4bd/2bth WITH A BONUS ROOM AND AN UPSTAIRS GAME ROOM. Located in St. Tammany, with great schools. This home comes with wood flooring, granite, stainless gas appliances and more. The home has an open concept with tons of windows for natural light to pour in. This home features a 2 car garage, covered back patio, and huge closets with real wood shelving.",NULL,225000,2017-12-04,2018-04-23,"2019-01-15 18:51:23","0000-00-00 00:00:00",0
50088,2,0,0,09631432,NULL,NULL,"520 S STATE Street",NULL,Chicago,,IL,IL,60605,"United States",NULL,"Highly sought after 1 bedroom in Library Tower, located in prime Printers Row/South loop location!! Spacious open floor plan, with 10 ft. ceilings, granite counter tops with backsplash, GE profile stainless steel appliances, oak cabinets, and hardwood floors. Unit includes W/D, glass tiled fireplace, and oversized balcony.  Common roof deck with grills, theater room, storage, fitness room, business center and 24 hour doorman. Close to El, shops on State Street, museums, theater district, restaurants and night life!  Assigned parking for $25K.","Highly sought after 1 bedroom in Library Tower, located in prime Printers Row/South loop location!! Spacious open floor plan, with 10 ft. ceilings, granite counter tops with backsplash, GE profile stainless steel appliances, oak cabinets, and hardwood floors. Unit includes W/D, glass tiled fireplace, and oversized balcony.  Common roof deck with grills, theater room, storage, fitness room, business center and 24 hour doorman. Close to El, shops on State Street, museums, theater district, restaurants and night life!  Assigned parking for $25K.",NULL,315000,2017-05-18,2017-08-16,"2019-01-15 19:00:04","0000-00-00 00:00:00",0
50089,2,0,0,10128507,NULL,NULL,"626 W 48th Pl",NULL,Chicago,,IL,IL,60609,"United States",NULL,"VACANT EASY TO SHOW/ BANK OWNED/SOLD AS IS/ NO SELLER DISCLOSURES/NO TERMITE/NO SURVEY/TAXES PRORATED AT 100%/PROOF OF FUNDS WITH ALL OFFERS.","VACANT EASY TO SHOW/ BANK OWNED/SOLD AS IS/ NO SELLER DISCLOSURES/NO TERMITE/NO SURVEY/TAXES PRORATED AT 100%/PROOF OF FUNDS WITH ALL OFFERS.",NULL,36200,2018-10-31,2018-12-31,"2019-01-15 19:00:05","0000-00-00 00:00:00",0
50090,2,0,0,09732651,NULL,NULL,"4012 S Albany Avenue",NULL,Chicago,,IL,IL,60632,"United States",NULL,"*** Multiple offers received, highest and best offer due by Friday 09/01/17 at 5pm *** Freshly painted and updated 2-flat, features central heat and ac, granite counter top, hardwood flooring; each unit has two bedrooms one full bath, great front yard, full unfinished basement and attic for laundry room, furnace and storage, the roof is 4-year old. Close to Archer, Kedzie and I-55. Nathan S. Davis Elementary School and St Pancratius School are 2 blocks away. For homeowners, why rent ? you put some down payment, the rental income can cover mortgage payment, taxes and insurance. For investors, it is a turnkey investment with pro forma 10% Cap rate.","*** Multiple offers received, highest and best offer due by Friday 09/01/17 at 5pm *** Freshly painted and updated 2-flat, features central heat and ac, granite counter top, hardwood flooring; each unit has two bedrooms one full bath, great front yard, full unfinished basement and attic for laundry room, furnace and storage, the roof is 4-year old. Close to Archer, Kedzie and I-55. Nathan S. Davis Elementary School and St Pancratius School are 2 blocks away. For homeowners, why rent ? you put some down payment, the rental income can cover mortgage payment, taxes and insurance. For investors, it is a turnkey investment with pro forma 10% Cap rate.",NULL,123000,2017-08-25,2017-11-10,"2019-01-15 19:00:05","0000-00-00 00:00:00",0
50091,2,0,0,10047315,NULL,NULL,"4744 S Hamlin Ave",NULL,Chicago,,IL,IL,60632,"United States",NULL,,,NULL,229900,2018-08-09,2018-09-13,"2019-01-15 19:00:05","0000-00-00 00:00:00",0
50092,2,0,0,10127608,NULL,NULL,"5332 S Wells St",NULL,Chicago,,IL,IL,60609,"United States",NULL,"Sizable Frame 2 Flat  Rear yard has concrete pad and newer 1 car garage. Each unit has living and formal dining rooms. Great investment property, close to expressway, transit train and bus line.","Sizable Frame 2 Flat  Rear yard has concrete pad and newer 1 car garage. Each unit has living and formal dining rooms. Great investment property, close to expressway, transit train and bus line.",NULL,29900,2018-11-01,2018-12-20,"2019-01-15 19:00:05","0000-00-00 00:00:00",0
50093,2,0,0,09351698,NULL,NULL,"11323 S Eggleston Avenue",NULL,Chicago,,IL,IL,60628,"United States",NULL,"THIS IS A SUPRISINGLY LARGE HOME AND OFFERS GREAT VALUE FOR YOUR MONEY. LIVE HERE CHEAPER THAN RENT. THERE A 4 NICE SIZED BEDROOMS PLUS AN OFFICE/BEDROOM IN THE LOWER LEVEL. FORMAL LIVING AND DINING ROOMS ON THE MAIN LEVEL AND A LARGE FAMILY ROOM IN THE LOWER LEVEL. THE KITCHEN IS BEAUTIFUL WITH STAINLESS STEEL APPLIANCES, GRANITE COUNTER TOP AND CUSTOM CABINETS. HARDWOOD FLOORS THROUGHOUT THE FIRST LEVEL. FULL WALKOUT BASEMENT AND A TWO CAR GARAGE. SELLER WILL WORK WITH SERIOUS BUYER. DEFINITELY WORTH A VISIT.","THIS IS A SUPRISINGLY LARGE HOME AND OFFERS GREAT VALUE FOR YOUR MONEY. LIVE HERE CHEAPER THAN RENT. THERE A 4 NICE SIZED BEDROOMS PLUS AN OFFICE/BEDROOM IN THE LOWER LEVEL. FORMAL LIVING AND DINING ROOMS ON THE MAIN LEVEL AND A LARGE FAMILY ROOM IN THE LOWER LEVEL. THE KITCHEN IS BEAUTIFUL WITH STAINLESS STEEL APPLIANCES, GRANITE COUNTER TOP AND CUSTOM CABINETS. HARDWOOD FLOORS THROUGHOUT THE FIRST LEVEL. FULL WALKOUT BASEMENT AND A TWO CAR GARAGE. SELLER WILL WORK WITH SERIOUS BUYER. DEFINITELY WORTH A VISIT.",NULL,110000,2016-09-26,2017-04-25,"2019-01-15 19:00:05","0000-00-00 00:00:00",0
50094,2,0,0,09861835,NULL,NULL,"2919 Portsmith Ct",NULL,Naperville,,IL,IL,60564,"United States",NULL,"THIS MAGNIFICENT HOME-LOCATED IN THE GEM OF THE HEATHERSTONE NEIGHBORHOOD*POND,PLAYGROUND,BASKETBALL CRT,LRG.GRASS FIELD*OUR OWN LITTLE SECRET!*NO TRAFFIC CUL-DE-SAC PERFECT FOR YOUR KIDS TO PLAY-PLUS ONE OF THE LG BEAUTIFULLY LANDSCAPED-PRIVATE-FENCED-FULL OF TREES BACKYARD IN NEIGHBORHOOD*RELAX - HOMEOWNER HAS TAKEN CARE OF EVERYTHING THAT CAN COST YOUR $$*$28,500 HAS BEEN INVESTED IN: NEW ROOF,FURNACE, A/C, 100% INTERIOR PAINT, BEAUTIFULLY UPGRADED KITCHEN W/STUNNING DARK GRANITE, GLEAMING STAINLESS STEEL APPLIANCES W/A TOP OF THE LINE GAS RANGE* IF YOU LIKE TO COOK - THIS MODEL HAS THE LARGEST KITCHEN W/ISLAND*GLEAMING DARK STAINED HW FLOORS*REMODELED MAIN FLOOR POWDER ROOM*COZY FAMILY ROOM WITH ALL BRICK GAS FIREPLACE THAT LOOKS OUT ON TO YOUR BEAUTIFUL TREE FILLED BACKYARD* ENJOY YOUR CUSTOM DESIGNED, PRIVATE PATIO, READY FOR OUTDOOR ENTERTAINING*4 BEDROOM ON 2ND FLOOR*LARGE BEAUTIFUL BASEMENT-PERFECT FOR THE KIDS PLAY/DAD TO BLD HIS SHOP*7 MILES DOWNTOWN NAPERVILLE*16 MIN TRAIN","THIS MAGNIFICENT HOME-LOCATED IN THE GEM OF THE HEATHERSTONE NEIGHBORHOOD*POND,PLAYGROUND,BASKETBALL CRT,LRG.GRASS FIELD*OUR OWN LITTLE SECRET!*NO TRAFFIC CUL-DE-SAC PERFECT FOR YOUR KIDS TO PLAY-PLUS ONE OF THE LG BEAUTIFULLY LANDSCAPED-PRIVATE-FENCED-FULL OF TREES BACKYARD IN NEIGHBORHOOD*RELAX - HOMEOWNER HAS TAKEN CARE OF EVERYTHING THAT CAN COST YOUR $$*$28,500 HAS BEEN INVESTED IN: NEW ROOF,FURNACE, A/C, 100% INTERIOR PAINT, BEAUTIFULLY UPGRADED KITCHEN W/STUNNING DARK GRANITE, GLEAMING STAINLESS STEEL APPLIANCES W/A TOP OF THE LINE GAS RANGE* IF YOU LIKE TO COOK - THIS MODEL HAS THE LARGEST KITCHEN W/ISLAND*GLEAMING DARK STAINED HW FLOORS*REMODELED MAIN FLOOR POWDER ROOM*COZY FAMILY ROOM WITH ALL BRICK GAS FIREPLACE THAT LOOKS OUT ON TO YOUR BEAUTIFUL TREE FILLED BACKYARD* ENJOY YOUR CUSTOM DESIGNED, PRIVATE PATIO, READY FOR OUTDOOR ENTERTAINING*4 BEDROOM ON 2ND FLOOR*LARGE BEAUTIFUL BASEMENT-PERFECT FOR THE KIDS PLAY/DAD TO BLD HIS SHOP*7 MILES DOWNTOWN NAPERVILLE*16 MIN TRAIN",NULL,395000,2018-02-18,2018-06-04,"2019-01-15 19:00:05","0000-00-00 00:00:00",0
